{
  "schema_version": 1,
  "target_kind": "unpromoted_world_flow_subset",
  "target_name": "core-dev-world-flow",
  "required_hub_ids": ["hub.lantern_halls_01"],
  "required_world_ids": ["world.core_microrealm_01"],
  "required_object_ids": [
    "landmark.lantern_fork",
    "landmark.realm_gate",
    "portal.dungeon.bell_sepulcher",
    "portal.return.lantern_halls",
    "spawn.hub.character_select_return",
    "station.memorial_wall",
    "station.oath_shrine",
    "station.overflow",
    "station.realm_gate",
    "station.vault"
  ],
  "required_asset_ids": [
    "sprite.landmark.lantern_fork",
    "sprite.landmark.realm_gate",
    "sprite.portal.dungeon.bell_sepulcher",
    "sprite.portal.return.lantern_halls",
    "sprite.station.memorial_wall",
    "sprite.station.oath_shrine",
    "sprite.station.overflow",
    "sprite.station.realm_gate",
    "sprite.station.vault",
    "tilemap.hub.lantern_halls_01",
    "tilemap.world.core_microrealm_01"
  ],
  "required_localization_keys": [
    "hub.lantern_halls_01.description",
    "hub.lantern_halls_01.name",
    "landmark.lantern_fork.description",
    "landmark.lantern_fork.name",
    "landmark.realm_gate.description",
    "landmark.realm_gate.name",
    "portal.dungeon.bell_sepulcher.description",
    "portal.dungeon.bell_sepulcher.name",
    "portal.return.lantern_halls.description",
    "portal.return.lantern_halls.name",
    "spawn.hub.character_select_return.description",
    "spawn.hub.character_select_return.name",
    "station.memorial_wall.description",
    "station.memorial_wall.name",
    "station.oath_shrine.description",
    "station.oath_shrine.name",
    "station.overflow.description",
    "station.overflow.name",
    "station.realm_gate.description",
    "station.realm_gate.name",
    "station.vault.description",
    "station.vault.name",
    "world.core_microrealm_01.description",
    "world.core_microrealm_01.name",
    "transition.action.exit",
    "transition.action.retry",
    "transition.action.return_character_select",
    "transition.handshake.account_suspended",
    "transition.handshake.authentication_failed",
    "transition.handshake.content_mismatch",
    "transition.handshake.internal_retryable",
    "transition.handshake.maintenance",
    "transition.handshake.protocol_unsupported",
    "transition.handshake.rate_limited",
    "transition.handshake.region_full",
    "transition.handshake.update_required",
    "transition.transfer.character_dead",
    "transition.transfer.character_not_found",
    "transition.transfer.character_not_owned",
    "transition.transfer.content_disabled",
    "transition.transfer.content_mismatch",
    "transition.transfer.destination_disabled",
    "transition.transfer.idempotency_conflict",
    "transition.transfer.incomplete_restore_point",
    "transition.transfer.instance_unavailable",
    "transition.transfer.invalid_source",
    "transition.transfer.issued_at_invalid",
    "transition.transfer.no_selected_character",
    "transition.transfer.out_of_range",
    "transition.transfer.payload_hash_mismatch",
    "transition.transfer.rate_limited",
    "transition.transfer.service_unavailable",
    "transition.transfer.stage_disabled",
    "transition.transfer.state_version_mismatch",
    "transition.transfer.storage_resolution_required",
    "transition.transfer.transfer_in_progress",
    "transition.phase.awaiting_authoritative_state",
    "transition.phase.fatal_error",
    "transition.phase.link_lost",
    "transition.phase.loading_content",
    "transition.phase.ready",
    "transition.phase.reconnecting",
    "transition.phase.recoverable_error",
    "transition.phase.requesting_transfer",
    "transition.phase.resolved_to_character_select",
    "transition.phase.resolved_to_hall",
    "transition.phase.safe_origin",
    "transition.status.no_progress",
    "transition.status.prior_safe_state",
    "transition.status.reconnect_attempt",
    "transition.status.vulnerability_warning"
  ],
  "expected_records_blake3": "97b7188e26329b9430b7289d1e17d347c9b9472863b7db6bd48501fd3b773158",
  "expected_assets_blake3": "32ce9fce6f1d49d5cd6cb570fa0590a5ee5644388c2620b67846320d4b2a3759",
  "expected_localization_blake3": "1f6c4e58c5935e3f7e1e7d322f9e263f14c8c16aea2b32701ec4ac6910adafbb"
}
